Sheet: Framing
A1: Team name: Syntax Modeling
A2: Team members: Sohini Bhattacharyya, Jenny Hong, Anna Nguyen
A3: Deliverable 1 - Framing
A6: Problem Statement
A7: Susan Chen is a 46-year-old married mid-level manager at a well-established Silicon Valley company. Her salary is currently $145,000. Her employer contributes an amount equal to 5% of her salary to a retirement fund, and Susan herself has been contributing $11,500 a year. The current value of her retirement fund is $182,000. Susan would like to know whether her current rate of retirement savings is adequate.
A10: Identify the critical decisions | B10: - Susan wants to know if her current rate of retirement savings is adequate
A11: Identify one or more possible outcome measures | B11: - will not have enough money for retirement
B12: - will have enough money for retirement
B13: - the age when she wants to retire will change her rate of savings
B14: - her savings largely depend on how much does she want to withdraw each year
B15: - her current salary multiplied by 80%, then multiplied by her expected life expetancy after retirement age will determine how much does she need in savings
A16: List the parameters | B16: her age, her current salary, her current rate of her retirement contribution, current value of her retirement fund
A17: List the decision variables | B17: - her rate of retirement contribution
B18: - the age that she wants to retire
B19: - how much does she want to withdraw
A20: Indicate what you plan to leave out | B20: - her lifestyle, her spending on hobby and leisures, state tax rate where she lives
A21: Indicate what assumptions you will make | B21: - She assumes that the inflation is stable
B22: - She assumes that she will live 20 more years after she retires
B23: - She assumes that her current salary will increase each year
A24: Indicate what is uncertain | B24: - how much income she will be getting from her job (will it increase each year?)
B25: - how many years to keep transferring $ to retirement savings fund in bank
B26: - she worries that her company could lay her off in the future
B27: - she worries that she will be demoted if the company changes its current business needs
B28: - she is unsure if her planned retirement age is enough to offset her lifestyle
A29: Identify any intangibles | B29: - # of years of putting $ in for retirement
B30: - which companies offer the best retirement fund
B31: - expenses after retirement (travel, health)

Sheet: Influence Diagram
A1: Team name: Syntax Modeling
A2: Team members: Sohini Bhattacharyya, Jenny Hong, Anna Nguyen
A3: Deliverable 2 - Influence Diagram

Sheet: Modeling
A1: Inputs
A2: Age | B2: 46 | E2: Amount she needs in savings after she retires | F2: of:=[.B12]/[.B11] -> 500000
A3: Current salary | B3: 145000 | E3: Amount that she has when she retires | F3: of:=[.F34] -> 621907.778329468
A4: Employer contribution | B4: 0.05
A5: Susan's contribution | B5: 11500
A6: Retirement fund current value | B6: 182000
A7: Life expectancy | B7: 30
A8: Retirement age | B8: 65
A9: Time span | B9: of:=[.B8]-[.B2] -> 19
A10: Salary increase/decrease | B10: 0.05
A11: Withdrawal rate | B11: 0.04
A12: Withdrawal per year after retiring | B12: 20000
A14: Model
A15: Year | B15: Salary (before taxes) | C15: of:=[.A4] -> Employer contribution | D15: of:=[.A5] -> Susan's contribution | E15: Total investment amount | F15: Ending fund balance | G15: Annual rate of return | H15: Add 1
A16: 1 | B16: 145000 | C16: of:=[.B16]*[.B$4] -> 7250 | D16: of:=[.B$5] -> 11500 | E16: of:=[.C16]+[.D16] -> 18750 | F16: of:=[.B6]+[.E16] -> 200750 | G16: of:=([.F16]-[.B$6])/[.B$6] -> 0.103021978021978 | H16: of:=[.G16]+1 -> 1.10302197802198
A17: 2 | B17: of:=[.B16]*([.B$10]+1) -> 152250 | C17: of:=[.B17]*[.B$4] -> 7612.5 | D17: of:=[.B$5] -> 11500 | E17: of:=[.C17]+[.D17] -> 19112.5 | F17: of:=[.E17]+[.F16] -> 219862.5 | G17: of:=([.F17]-[.F16])/[.F16] -> 0.0952054794520548 | H17: of:=[.G17]+1 -> 1.09520547945205
A18: 3 | B18: of:=[.B17]*([.B$10]+1) -> 159862.5 | C18: of:=[.B18]*[.B$4] -> 7993.125 | D18: of:=[.B$5] -> 11500 | E18: of:=[.C18]+[.D18] -> 19493.125 | F18: of:=[.E18]+[.F17] -> 239355.625 | G18: of:=([.F18]-[.F17])/[.F17] -> 0.0886605264654045 | H18: of:=[.G18]+1 -> 1.0886605264654
A19: 4 | B19: of:=[.B18]*([.B$10]+1) -> 167855.625 | C19: of:=[.B19]*[.B$4] -> 8392.78125 | D19: of:=[.B$5] -> 11500 | E19: of:=[.C19]+[.D19] -> 19892.78125 | F19: of:=[.E19]+[.F18] -> 259248.40625 | G19: of:=([.F19]-[.F18])/[.F18] -> 0.0831097295081325 | H19: of:=[.G19]+1 -> 1.08310972950813
A20: 5 | B20: of:=[.B19]*([.B$10]+1) -> 176248.40625 | C20: of:=[.B20]*[.B$4] -> 8812.4203125 | D20: of:=[.B$5] -> 11500 | E20: of:=[.C20]+[.D20] -> 20312.4203125 | F20: of:=[.E20]+[.F19] -> 279560.8265625 | G20: of:=([.F20]-[.F19])/[.F19] -> 0.0783511868262449 | H20: of:=[.G20]+1 -> 1.07835118682624
A21: 6 | B21: of:=[.B20]*([.B$10]+1) -> 185060.8265625 | C21: of:=[.B21]*[.B$4] -> 9253.041328125 | D21: of:=[.B$5] -> 11500 | E21: of:=[.C21]+[.D21] -> 20753.041328125 | F21: of:=[.E21]+[.F20] -> 300313.867890625 | G21: of:=([.F21]-[.F20])/[.F20] -> 0.074234439722138 | H21: of:=[.G21]+1 -> 1.07423443972214
A22: 7 | B22: of:=[.B21]*([.B$10]+1) -> 194313.867890625 | C22: of:=[.B22]*[.B$4] -> 9715.69339453125 | D22: of:=[.B$5] -> 11500 | E22: of:=[.C22]+[.D22] -> 21215.6933945313 | F22: of:=[.E22]+[.F21] -> 321529.561285156 | G22: of:=([.F22]-[.F21])/[.F21] -> 0.070645067254297 | H22: of:=[.G22]+1 -> 1.0706450672543
A23: 8 | B23: of:=[.B22]*([.B$10]+1) -> 204029.561285156 | C23: of:=[.B23]*[.B$4] -> 10201.4780642578 | D23: of:=[.B$5] -> 11500 | E23: of:=[.C23]+[.D23] -> 21701.4780642578 | F23: of:=[.E23]+[.F22] -> 343231.039349414 | G23: of:=([.F23]-[.F22])/[.F22] -> 0.0674945033903472 | H23: of:=[.G23]+1 -> 1.06749450339035
A24: 9 | B24: of:=[.B23]*([.B$10]+1) -> 214231.039349414 | C24: of:=[.B24]*[.B$4] -> 10711.5519674707 | D24: of:=[.B$5] -> 11500 | E24: of:=[.C24]+[.D24] -> 22211.5519674707 | F24: of:=[.E24]+[.F23] -> 365442.591316885 | G24: of:=([.F24]-[.F23])/[.F23] -> 0.0647131215451032 | H24: of:=[.G24]+1 -> 1.0647131215451
A25: 10 | B25: of:=[.B24]*([.B$10]+1) -> 224942.591316885 | C25: of:=[.B25]*[.B$4] -> 11247.1295658442 | D25: of:=[.B$5] -> 11500 | E25: of:=[.C25]+[.D25] -> 22747.1295658442 | F25: of:=[.E25]+[.F24] -> 388189.720882729 | G25: of:=([.F25]-[.F24])/[.F24] -> 0.0622454254274911 | H25: of:=[.G25]+1 -> 1.06224542542749
A26: 11 | B26: of:=[.B25]*([.B$10]+1) -> 236189.720882729 | C26: of:=[.B26]*[.B$4] -> 11809.4860441365 | D26: of:=[.B$5] -> 11500 | E26: of:=[.C26]+[.D26] -> 23309.4860441365 | F26: of:=[.E26]+[.F25] -> 411499.206926866 | G26: of:=([.F26]-[.F25])/[.F25] -> 0.0600466338756512 | H26: of:=[.G26]+1 -> 1.06004663387565
A27: 12 | B27: of:=[.B26]*([.B$10]+1) -> 247999.206926866 | C27: of:=[.B27]*[.B$4] -> 12399.9603463433 | D27: of:=[.B$5] -> 11500 | E27: of:=[.C27]+[.D27] -> 23899.9603463433 | F27: of:=[.E27]+[.F26] -> 435399.167273209 | G27: of:=([.F27]-[.F26])/[.F26] -> 0.058080209983469 | H27: of:=[.G27]+1 -> 1.05808020998347
A28: 13 | B28: of:=[.B27]*([.B$10]+1) -> 260399.167273209 | C28: of:=[.B28]*[.B$4] -> 13019.9583636604 | D28: of:=[.B$5] -> 11500 | E28: of:=[.C28]+[.D28] -> 24519.9583636604 | F28: of:=[.E28]+[.F27] -> 459919.125636869 | G28: of:=([.F28]-[.F27])/[.F27] -> 0.0563160433154306 | H28: of:=[.G28]+1 -> 1.05631604331543
A29: 14 | B29: of:=[.B28]*([.B$10]+1) -> 273419.125636869 | C29: of:=[.B29]*[.B$4] -> 13670.9562818435 | D29: of:=[.B$5] -> 11500 | E29: of:=[.C29]+[.D29] -> 25170.9562818435 | F29: of:=[.E29]+[.F28] -> 485090.081918713 | G29: of:=([.F29]-[.F28])/[.F28] -> 0.0547290923094103 | H29: of:=[.G29]+1 -> 1.05472909230941
A30: 15 | B30: of:=[.B29]*([.B$10]+1) -> 287090.081918713 | C30: of:=[.B30]*[.B$4] -> 14354.5040959356 | D30: of:=[.B$5] -> 11500 | E30: of:=[.C30]+[.D30] -> 25854.5040959356 | F30: of:=[.E30]+[.F29] -> 510944.586014648 | G30: of:=([.F30]-[.F29])/[.F29] -> 0.0532983564489123 | H30: of:=[.G30]+1 -> 1.05329835644891
A31: 16 | B31: of:=[.B30]*([.B$10]+1) -> 301444.586014648 | C31: of:=[.B31]*[.B$4] -> 15072.2293007324 | D31: of:=[.B$5] -> 11500 | E31: of:=[.C31]+[.D31] -> 26572.2293007324 | F31: of:=[.E31]+[.F30] -> 537516.815315381 | G31: of:=([.F31]-[.F30])/[.F30] -> 0.0520060883862082 | H31: of:=[.G31]+1 -> 1.05200608838621
A32: 17 | B32: of:=[.B31]*([.B$10]+1) -> 316516.815315381 | C32: of:=[.B32]*[.B$4] -> 15825.840765769 | D32: of:=[.B$5] -> 11500 | E32: of:=[.C32]+[.D32] -> 27325.840765769 | F32: of:=[.E32]+[.F31] -> 564842.65608115 | G32: of:=([.F32]-[.F31])/[.F31] -> 0.0508371831116315 | H32: of:=[.G32]+1 -> 1.05083718311163
A33: 18 | B33: of:=[.B32]*([.B$10]+1) -> 332342.65608115 | C33: of:=[.B33]*[.B$4] -> 16617.1328040575 | D33: of:=[.B$5] -> 11500 | E33: of:=[.C33]+[.D33] -> 28117.1328040575 | F33: of:=[.E33]+[.F32] -> 592959.788885207 | G33: of:=([.F33]-[.F32])/[.F32] -> 0.0497786994331 | H33: of:=[.G33]+1 -> 1.0497786994331
A34: 19 | B34: of:=[.B33]*([.B$10]+1) -> 348959.788885207 | C34: of:=[.B34]*[.B$4] -> 17447.9894442604 | D34: of:=[.B$5] -> 11500 | E34: of:=[.C34]+[.D34] -> 28947.9894442604 | F34: of:=[.E34]+[.F33] -> 621907.778329468 | G34: of:=([.F34]-[.F33])/[.F33] -> 0.0488194815009024 | H34: of:=[.G34]+1 -> 1.0488194815009
G35: Time-weighted return | H35: of:=([.H16]*[.H17]*[.H18]*[.H19]*[.H20]*[.H21]*[.H22]*[.H23]*[.H24]*[.H25]*[.H26]*[.H27]*[.H28]*[.H29]*[.H30]*[.H31]*[.H32]*[.H33]*[.H34])-1 -> 2.41707570510696
G36: Annualized return (based on TWR) | H36: of:=(1+[.H35])^(1/19) -1 -> 0.0668100153411417
G37: Annualized return (CAGR) | H37: of:=([.F34]/[.B6])^(1/19)-1 -> 0.0668100153411417
A43: References:
A44: https://www.fool.com/about/how-to-calculate-investment-returns/
A45: https://www.wallstreetmojo.com/cagr-formula/
A46: https://www.thebalance.com/retirement-savings-benchmarks-4150169

Sheet: Generate insights
A1: Inputs | H1: Inputs | I1: Original values | J1: 10% increase | L1: Inputs | M1: Absolute impact of 10% change (based on rate of return)
A2: Age | B2: 46 | E2: Amount she needs in savings after she retires | F2: of:=[.B12]/[.B11] -> 500000 | H2: Current salary | I2: 145000 | J2: of:=[.I2]*1.1 -> 159500 | L2: Retirement fund current value (before she turns 46) | M2: 0.0037
A3: Current salary | B3: 145000 | E3: Amount that she has when she retires | F3: of:=[.F39] -> 621907.778329468 | H3: Employer contribution | I3: 0.05 | J3: of:=[.I3]*1.1 -> 0.055 | L3: Susan's contribution | M3: 0.002
A4: Employer contribution | B4: 0.05 | E4: Rate of return | F4: of:=[.H45] -> 0.0668100153411417 | H4: Susan's contribution | I4: 11500 | J4: of:=[.I4]*1.1 -> 12650 | L4: Current salary | M4: 0.002
A5: Susan's contribution | B5: 11500 | E5: Difference | F5: of:=[.F3]-[.F2] -> 121907.778329468 | H5: Retirement fund current value (before she turns 46) | I5: 182000 | J5: of:=[.I5]*1.1 -> 200200 | L5: Employer contribution | M5: 0.002
A6: Retirement fund current value | B6: 182000 | H6: Salary increase/decrease | I6: 0.05 | J6: of:=[.I6]*1.1 -> 0.055 | L6: Salary increase/decrease | M6: 0.001
A7: Life expectancy | B7: 30
A8: Retirement age | B8: 65 | I8: of:=[.H1] -> Inputs | J8: Absolute impact of 10% change (based on ending fund balance)
A9: Time span | B9: of:=[.B8]-[.B2] -> 19 | I9: Current salary | J9: 22141
A10: Salary increase/decrease | B10: 0.05 | I10: Employer contribution | J10: 22141
A11: Withdrawal rate | B11: 0.04 | I11: Susan's contribution | J11: 21850
A12: Withdrawal per year after retiring | B12: 20000 | I12: Retirement fund current value | J12: 18200
I13: Salary increase/decrease | J13: 11336
I15: Baseline ending balance | J15: 621908
I16: Change in ending balance | J16: of:=[.F3]-[.J15] -> -0.221670532482676
I18: Baseline ending balance | J18: 0.0668
A19: Model | I19: Change in ending balance | J19: of:=[.F4]-[.J18] -> 0.0000100153411417281
A20: Year | B20: Salary (before taxes) | C20: of:=[.A4] -> Employer contribution | D20: of:=[.A5] -> Susan's contribution | E20: Total investment amount | F20: Ending fund balance | G20: Annual rate of return | H20: Add 1
A21: 1 | B21: of:=[.B3] -> 145000 | C21: of:=[.B21]*[.B$4] -> 7250 | D21: of:=[.B$5] -> 11500 | E21: of:=[.C21]+[.D21] -> 18750 | F21: of:=[.B6]+[.E21] -> 200750 | G21: of:=([.F21]-[.B$6])/[.B$6] -> 0.103021978021978 | H21: of:=[.G21]+1 -> 1.10302197802198
A22: 2 | B22: of:=[.B21]*([.B$10]+1) -> 152250 | C22: of:=[.B22]*[.B$4] -> 7612.5 | D22: of:=[.B$5] -> 11500 | E22: of:=[.C22]+[.D22] -> 19112.5 | F22: of:=[.E22]+[.F21] -> 219862.5 | G22: of:=([.F22]-[.F21])/[.F21] -> 0.0952054794520548 | H22: of:=[.G22]+1 -> 1.09520547945205
A23: 3 | B23: of:=[.B22]*([.B$10]+1) -> 159862.5 | C23: of:=[.B23]*[.B$4] -> 7993.125 | D23: of:=[.B$5] -> 11500 | E23: of:=[.C23]+[.D23] -> 19493.125 | F23: of:=[.E23]+[.F22] -> 239355.625 | G23: of:=([.F23]-[.F22])/[.F22] -> 0.0886605264654045 | H23: of:=[.G23]+1 -> 1.0886605264654
A24: 4 | B24: of:=[.B23]*([.B$10]+1) -> 167855.625 | C24: of:=[.B24]*[.B$4] -> 8392.78125 | D24: of:=[.B$5] -> 11500 | E24: of:=[.C24]+[.D24] -> 19892.78125 | F24: of:=[.E24]+[.F23] -> 259248.40625 | G24: of:=([.F24]-[.F23])/[.F23] -> 0.0831097295081325 | H24: of:=[.G24]+1 -> 1.08310972950813
A25: 5 | B25: of:=[.B24]*([.B$10]+1) -> 176248.40625 | C25: of:=[.B25]*[.B$4] -> 8812.4203125 | D25: of:=[.B$5] -> 11500 | E25: of:=[.C25]+[.D25] -> 20312.4203125 | F25: of:=[.E25]+[.F24] -> 279560.8265625 | G25: of:=([.F25]-[.F24])/[.F24] -> 0.0783511868262449 | H25: of:=[.G25]+1 -> 1.07835118682624
A26: 6 | B26: of:=[.B25]*([.B$10]+1) -> 185060.8265625 | C26: of:=[.B26]*[.B$4] -> 9253.041328125 | D26: of:=[.B$5] -> 11500 | E26: of:=[.C26]+[.D26] -> 20753.041328125 | F26: of:=[.E26]+[.F25] -> 300313.867890625 | G26: of:=([.F26]-[.F25])/[.F25] -> 0.074234439722138 | H26: of:=[.G26]+1 -> 1.07423443972214
A27: 7 | B27: of:=[.B26]*([.B$10]+1) -> 194313.867890625 | C27: of:=[.B27]*[.B$4] -> 9715.69339453125 | D27: of:=[.B$5] -> 11500 | E27: of:=[.C27]+[.D27] -> 21215.6933945313 | F27: of:=[.E27]+[.F26] -> 321529.561285156 | G27: of:=([.F27]-[.F26])/[.F26] -> 0.070645067254297 | H27: of:=[.G27]+1 -> 1.0706450672543
A28: 8 | B28: of:=[.B27]*([.B$10]+1) -> 204029.561285156 | C28: of:=[.B28]*[.B$4] -> 10201.4780642578 | D28: of:=[.B$5] -> 11500 | E28: of:=[.C28]+[.D28] -> 21701.4780642578 | F28: of:=[.E28]+[.F27] -> 343231.039349414 | G28: of:=([.F28]-[.F27])/[.F27] -> 0.0674945033903472 | H28: of:=[.G28]+1 -> 1.06749450339035
A29: 9 | B29: of:=[.B28]*([.B$10]+1) -> 214231.039349414 | C29: of:=[.B29]*[.B$4] -> 10711.5519674707 | D29: of:=[.B$5] -> 11500 | E29: of:=[.C29]+[.D29] -> 22211.5519674707 | F29: of:=[.E29]+[.F28] -> 365442.591316885 | G29: of:=([.F29]-[.F28])/[.F28] -> 0.0647131215451032 | H29: of:=[.G29]+1 -> 1.0647131215451
A30: 10 | B30: of:=[.B29]*([.B$10]+1) -> 224942.591316885 | C30: of:=[.B30]*[.B$4] -> 11247.1295658442 | D30: of:=[.B$5] -> 11500 | E30: of:=[.C30]+[.D30] -> 22747.1295658442 | F30: of:=[.E30]+[.F29] -> 388189.720882729 | G30: of:=([.F30]-[.F29])/[.F29] -> 0.0622454254274911 | H30: of:=[.G30]+1 -> 1.06224542542749
A31: 11 | B31: of:=[.B30]*([.B$10]+1) -> 236189.720882729 | C31: of:=[.B31]*[.B$4] -> 11809.4860441365 | D31: of:=[.B$5] -> 11500 | E31: of:=[.C31]+[.D31] -> 23309.4860441365 | F31: of:=[.E31]+[.F30] -> 411499.206926866 | G31: of:=([.F31]-[.F30])/[.F30] -> 0.0600466338756512 | H31: of:=[.G31]+1 -> 1.06004663387565
A32: 12 | B32: of:=[.B31]*([.B$10]+1) -> 247999.206926866 | C32: of:=[.B32]*[.B$4] -> 12399.9603463433 | D32: of:=[.B$5] -> 11500 | E32: of:=[.C32]+[.D32] -> 23899.9603463433 | F32: of:=[.E32]+[.F31] -> 435399.167273209 | G32: of:=([.F32]-[.F31])/[.F31] -> 0.058080209983469 | H32: of:=[.G32]+1 -> 1.05808020998347
A33: 13 | B33: of:=[.B32]*([.B$10]+1) -> 260399.167273209 | C33: of:=[.B33]*[.B$4] -> 13019.9583636604 | D33: of:=[.B$5] -> 11500 | E33: of:=[.C33]+[.D33] -> 24519.9583636604 | F33: of:=[.E33]+[.F32] -> 459919.125636869 | G33: of:=([.F33]-[.F32])/[.F32] -> 0.0563160433154306 | H33: of:=[.G33]+1 -> 1.05631604331543
A34: 14 | B34: of:=[.B33]*([.B$10]+1) -> 273419.125636869 | C34: of:=[.B34]*[.B$4] -> 13670.9562818435 | D34: of:=[.B$5] -> 11500 | E34: of:=[.C34]+[.D34] -> 25170.9562818435 | F34: of:=[.E34]+[.F33] -> 485090.081918713 | G34: of:=([.F34]-[.F33])/[.F33] -> 0.0547290923094103 | H34: of:=[.G34]+1 -> 1.05472909230941
A35: 15 | B35: of:=[.B34]*([.B$10]+1) -> 287090.081918713 | C35: of:=[.B35]*[.B$4] -> 14354.5040959356 | D35: of:=[.B$5] -> 11500 | E35: of:=[.C35]+[.D35] -> 25854.5040959356 | F35: of:=[.E35]+[.F34] -> 510944.586014648 | G35: of:=([.F35]-[.F34])/[.F34] -> 0.0532983564489123 | H35: of:=[.G35]+1 -> 1.05329835644891
A36: 16 | B36: of:=[.B35]*([.B$10]+1) -> 301444.586014648 | C36: of:=[.B36]*[.B$4] -> 15072.2293007324 | D36: of:=[.B$5] -> 11500 | E36: of:=[.C36]+[.D36] -> 26572.2293007324 | F36: of:=[.E36]+[.F35] -> 537516.815315381 | G36: of:=([.F36]-[.F35])/[.F35] -> 0.0520060883862082 | H36: of:=[.G36]+1 -> 1.05200608838621
A37: 17 | B37: of:=[.B36]*([.B$10]+1) -> 316516.815315381 | C37: of:=[.B37]*[.B$4] -> 15825.840765769 | D37: of:=[.B$5] -> 11500 | E37: of:=[.C37]+[.D37] -> 27325.840765769 | F37: of:=[.E37]+[.F36] -> 564842.65608115 | G37: of:=([.F37]-[.F36])/[.F36] -> 0.0508371831116315 | H37: of:=[.G37]+1 -> 1.05083718311163
A38: 18 | B38: of:=[.B37]*([.B$10]+1) -> 332342.65608115 | C38: of:=[.B38]*[.B$4] -> 16617.1328040575 | D38: of:=[.B$5] -> 11500 | E38: of:=[.C38]+[.D38] -> 28117.1328040575 | F38: of:=[.E38]+[.F37] -> 592959.788885207 | G38: of:=([.F38]-[.F37])/[.F37] -> 0.0497786994331 | H38: of:=[.G38]+1 -> 1.0497786994331
A39: 19 | B39: of:=[.B38]*([.B$10]+1) -> 348959.788885207 | C39: of:=[.B39]*[.B$4] -> 17447.9894442604 | D39: of:=[.B$5] -> 11500 | E39: of:=[.C39]+[.D39] -> 28947.9894442604 | F39: of:=[.E39]+[.F38] -> 621907.778329468 | G39: of:=([.F39]-[.F38])/[.F38] -> 0.0488194815009024 | H39: of:=[.G39]+1 -> 1.0488194815009
G43: Time-weighted return | H43: of:=([.H21]*[.H22]*[.H23]*[.H24]*[.H25]*[.H26]*[.H27]*[.H28]*[.H29]*[.H30]*[.H31]*[.H32]*[.H33]*[.H34]*[.H35]*[.H36]*[.H37]*[.H38]*[.H39])-1 -> 2.41707570510696
G44: Annualized return (based on TWR) | H44: of:=(1+[.H43])^(1/19) -1 -> 0.0668100153411417
G45: Annualized return (CAGR) | H45: of:=([.F39]/[.B6])^(1/19)-1 -> 0.0668100153411417
A51: References:
A52: https://www.fool.com/about/how-to-calculate-investment-returns/
A53: https://www.wallstreetmojo.com/cagr-formula/
A54: https://www.thebalance.com/retirement-savings-benchmarks-4150169

Sheet: Generate insights (cont)
A1: Inputs | H1: of:=[.A5] -> Susan's contribution | I1: Ending fund balance | K1: of:=[.H1] -> Susan's contribution | L1: Rate of return
A2: Age | B2: 46 | E2: Amount she needs in savings after she retires | F2: of:=[.B12]/[.B11] -> 500000 | H2: 11500 | I2: 621908 | K2: of:=[.H2] -> 11500 | L2: 0.0668
A3: Current salary | B3: 145000 | E3: Amount that she has when she retires | F3: of:=[.F34] -> 621907.778329468 | H3: of:=[.H2]+1000 -> 12500 | I3: 640908 | K3: of:=[.H3] -> 12500 | L3: 0.0685
A4: Employer contribution | B4: 0.05 | E4: Rate of return | F4: of:=[.H37] -> 0.0668100153411417 | H4: of:=[.H3]+1000 -> 13500 | I4: 659908 | K4: of:=[.H4] -> 13500 | L4: 0.0701
A5: Susan's contribution | B5: 11500 | H5: of:=[.H4]+1000 -> 14500 | I5: 678908 | K5: of:=[.H5] -> 14500 | L5: 0.0717
A6: Retirement fund current value | B6: 182000 | H6: of:=[.H5]+1000 -> 15500 | I6: 697908 | K6: of:=[.H6] -> 15500 | L6: 0.0733
A7: Life expectancy | B7: 30 | H7: of:=[.H6]+1000 -> 16500 | I7: 716908 | K7: of:=[.H7] -> 16500 | L7: 0.0748 | P7: 0.0668
A8: Retirement age | B8: 65 | H8: of:=[.H7]+1000 -> 17500 | I8: 735908 | K8: of:=[.H8] -> 17500 | L8: 0.0763
A9: Time span | B9: of:=[.B8]-[.B2] -> 19 | H9: of:=[.H8]+1000 -> 18500 | I9: 754908 | K9: of:=[.H9] -> 18500 | L9: 0.0777
A10: Salary increase/decrease | B10: 0.05 | H10: of:=[.H9]+1000 -> 19500 | I10: 773908 | K10: of:=[.H10] -> 19500 | L10: 0.0792
A11: Withdrawal rate | B11: 0.04
A12: Withdrawal per year after retiring | B12: 20000
A14: Model
A15: Year | B15: Salary (before taxes) | C15: of:=[.A4] -> Employer contribution | D15: of:=[.A5] -> Susan's contribution | E15: Total investment amount | F15: Ending fund balance | G15: Annual rate of return | H15: Add 1
A16: 1 | B16: of:=[.B3] -> 145000 | C16: of:=[.B16]*[.B$4] -> 7250 | D16: of:=[.B$5] -> 11500 | E16: of:=[.C16]+[.D16] -> 18750 | F16: of:=[.B6]+[.E16] -> 200750 | G16: of:=([.F16]-[.B$6])/[.B$6] -> 0.103021978021978 | H16: of:=[.G16]+1 -> 1.10302197802198
A17: 2 | B17: of:=[.B16]*([.B$10]+1) -> 152250 | C17: of:=[.B17]*[.B$4] -> 7612.5 | D17: of:=[.B$5] -> 11500 | E17: of:=[.C17]+[.D17] -> 19112.5 | F17: of:=[.E17]+[.F16] -> 219862.5 | G17: of:=([.F17]-[.F16])/[.F16] -> 0.0952054794520548 | H17: of:=[.G17]+1 -> 1.09520547945205
A18: 3 | B18: of:=[.B17]*([.B$10]+1) -> 159862.5 | C18: of:=[.B18]*[.B$4] -> 7993.125 | D18: of:=[.B$5] -> 11500 | E18: of:=[.C18]+[.D18] -> 19493.125 | F18: of:=[.E18]+[.F17] -> 239355.625 | G18: of:=([.F18]-[.F17])/[.F17] -> 0.0886605264654045 | H18: of:=[.G18]+1 -> 1.0886605264654
A19: 4 | B19: of:=[.B18]*([.B$10]+1) -> 167855.625 | C19: of:=[.B19]*[.B$4] -> 8392.78125 | D19: of:=[.B$5] -> 11500 | E19: of:=[.C19]+[.D19] -> 19892.78125 | F19: of:=[.E19]+[.F18] -> 259248.40625 | G19: of:=([.F19]-[.F18])/[.F18] -> 0.0831097295081325 | H19: of:=[.G19]+1 -> 1.08310972950813
A20: 5 | B20: of:=[.B19]*([.B$10]+1) -> 176248.40625 | C20: of:=[.B20]*[.B$4] -> 8812.4203125 | D20: of:=[.B$5] -> 11500 | E20: of:=[.C20]+[.D20] -> 20312.4203125 | F20: of:=[.E20]+[.F19] -> 279560.8265625 | G20: of:=([.F20]-[.F19])/[.F19] -> 0.0783511868262449 | H20: of:=[.G20]+1 -> 1.07835118682624
A21: 6 | B21: of:=[.B20]*([.B$10]+1) -> 185060.8265625 | C21: of:=[.B21]*[.B$4] -> 9253.041328125 | D21: of:=[.B$5] -> 11500 | E21: of:=[.C21]+[.D21] -> 20753.041328125 | F21: of:=[.E21]+[.F20] -> 300313.867890625 | G21: of:=([.F21]-[.F20])/[.F20] -> 0.074234439722138 | H21: of:=[.G21]+1 -> 1.07423443972214
A22: 7 | B22: of:=[.B21]*([.B$10]+1) -> 194313.867890625 | C22: of:=[.B22]*[.B$4] -> 9715.69339453125 | D22: of:=[.B$5] -> 11500 | E22: of:=[.C22]+[.D22] -> 21215.6933945313 | F22: of:=[.E22]+[.F21] -> 321529.561285156 | G22: of:=([.F22]-[.F21])/[.F21] -> 0.070645067254297 | H22: of:=[.G22]+1 -> 1.0706450672543
A23: 8 | B23: of:=[.B22]*([.B$10]+1) -> 204029.561285156 | C23: of:=[.B23]*[.B$4] -> 10201.4780642578 | D23: of:=[.B$5] -> 11500 | E23: of:=[.C23]+[.D23] -> 21701.4780642578 | F23: of:=[.E23]+[.F22] -> 343231.039349414 | G23: of:=([.F23]-[.F22])/[.F22] -> 0.0674945033903472 | H23: of:=[.G23]+1 -> 1.06749450339035
A24: 9 | B24: of:=[.B23]*([.B$10]+1) -> 214231.039349414 | C24: of:=[.B24]*[.B$4] -> 10711.5519674707 | D24: of:=[.B$5] -> 11500 | E24: of:=[.C24]+[.D24] -> 22211.5519674707 | F24: of:=[.E24]+[.F23] -> 365442.591316885 | G24: of:=([.F24]-[.F23])/[.F23] -> 0.0647131215451032 | H24: of:=[.G24]+1 -> 1.0647131215451
A25: 10 | B25: of:=[.B24]*([.B$10]+1) -> 224942.591316885 | C25: of:=[.B25]*[.B$4] -> 11247.1295658442 | D25: of:=[.B$5] -> 11500 | E25: of:=[.C25]+[.D25] -> 22747.1295658442 | F25: of:=[.E25]+[.F24] -> 388189.720882729 | G25: of:=([.F25]-[.F24])/[.F24] -> 0.0622454254274911 | H25: of:=[.G25]+1 -> 1.06224542542749
A26: 11 | B26: of:=[.B25]*([.B$10]+1) -> 236189.720882729 | C26: of:=[.B26]*[.B$4] -> 11809.4860441365 | D26: of:=[.B$5] -> 11500 | E26: of:=[.C26]+[.D26] -> 23309.4860441365 | F26: of:=[.E26]+[.F25] -> 411499.206926866 | G26: of:=([.F26]-[.F25])/[.F25] -> 0.0600466338756512 | H26: of:=[.G26]+1 -> 1.06004663387565
A27: 12 | B27: of:=[.B26]*([.B$10]+1) -> 247999.206926866 | C27: of:=[.B27]*[.B$4] -> 12399.9603463433 | D27: of:=[.B$5] -> 11500 | E27: of:=[.C27]+[.D27] -> 23899.9603463433 | F27: of:=[.E27]+[.F26] -> 435399.167273209 | G27: of:=([.F27]-[.F26])/[.F26] -> 0.058080209983469 | H27: of:=[.G27]+1 -> 1.05808020998347
A28: 13 | B28: of:=[.B27]*([.B$10]+1) -> 260399.167273209 | C28: of:=[.B28]*[.B$4] -> 13019.9583636604 | D28: of:=[.B$5] -> 11500 | E28: of:=[.C28]+[.D28] -> 24519.9583636604 | F28: of:=[.E28]+[.F27] -> 459919.125636869 | G28: of:=([.F28]-[.F27])/[.F27] -> 0.0563160433154306 | H28: of:=[.G28]+1 -> 1.05631604331543
A29: 14 | B29: of:=[.B28]*([.B$10]+1) -> 273419.125636869 | C29: of:=[.B29]*[.B$4] -> 13670.9562818435 | D29: of:=[.B$5] -> 11500 | E29: of:=[.C29]+[.D29] -> 25170.9562818435 | F29: of:=[.E29]+[.F28] -> 485090.081918713 | G29: of:=([.F29]-[.F28])/[.F28] -> 0.0547290923094103 | H29: of:=[.G29]+1 -> 1.05472909230941
A30: 15 | B30: of:=[.B29]*([.B$10]+1) -> 287090.081918713 | C30: of:=[.B30]*[.B$4] -> 14354.5040959356 | D30: of:=[.B$5] -> 11500 | E30: of:=[.C30]+[.D30] -> 25854.5040959356 | F30: of:=[.E30]+[.F29] -> 510944.586014648 | G30: of:=([.F30]-[.F29])/[.F29] -> 0.0532983564489123 | H30: of:=[.G30]+1 -> 1.05329835644891
A31: 16 | B31: of:=[.B30]*([.B$10]+1) -> 301444.586014648 | C31: of:=[.B31]*[.B$4] -> 15072.2293007324 | D31: of:=[.B$5] -> 11500 | E31: of:=[.C31]+[.D31] -> 26572.2293007324 | F31: of:=[.E31]+[.F30] -> 537516.815315381 | G31: of:=([.F31]-[.F30])/[.F30] -> 0.0520060883862082 | H31: of:=[.G31]+1 -> 1.05200608838621
A32: 17 | B32: of:=[.B31]*([.B$10]+1) -> 316516.815315381 | C32: of:=[.B32]*[.B$4] -> 15825.840765769 | D32: of:=[.B$5] -> 11500 | E32: of:=[.C32]+[.D32] -> 27325.840765769 | F32: of:=[.E32]+[.F31] -> 564842.65608115 | G32: of:=([.F32]-[.F31])/[.F31] -> 0.0508371831116315 | H32: of:=[.G32]+1 -> 1.05083718311163
A33: 18 | B33: of:=[.B32]*([.B$10]+1) -> 332342.65608115 | C33: of:=[.B33]*[.B$4] -> 16617.1328040575 | D33: of:=[.B$5] -> 11500 | E33: of:=[.C33]+[.D33] -> 28117.1328040575 | F33: of:=[.E33]+[.F32] -> 592959.788885207 | G33: of:=([.F33]-[.F32])/[.F32] -> 0.0497786994331 | H33: of:=[.G33]+1 -> 1.0497786994331
A34: 19 | B34: of:=[.B33]*([.B$10]+1) -> 348959.788885207 | C34: of:=[.B34]*[.B$4] -> 17447.9894442604 | D34: of:=[.B$5] -> 11500 | E34: of:=[.C34]+[.D34] -> 28947.9894442604 | F34: of:=[.E34]+[.F33] -> 621907.778329468 | G34: of:=([.F34]-[.F33])/[.F33] -> 0.0488194815009024 | H34: of:=[.G34]+1 -> 1.0488194815009
G35: Time-weighted return | H35: of:=([.H16]*[.H17]*[.H18]*[.H19]*[.H20]*[.H21]*[.H22]*[.H23]*[.H24]*[.H25]*[.H26]*[.H27]*[.H28]*[.H29]*[.H30]*[.H31]*[.H32]*[.H33]*[.H34])-1 -> 2.41707570510696
G36: Annualized return (based on TWR) | H36: of:=(1+[.H35])^(1/19) -1 -> 0.0668100153411417
G37: Annualized return (CAGR) | H37: of:=([.F34]/[.B6])^(1/19)-1 -> 0.0668100153411417
A43: References:
A44: https://www.fool.com/about/how-to-calculate-investment-returns/
A45: https://www.wallstreetmojo.com/cagr-formula/
A46: https://www.thebalance.com/retirement-savings-benchmarks-4150169